{
  "schema_version": "v1",
  "generated_at": "2026-03-15T00:00:00Z",
  "expires_at": "2026-03-16T00:00:00Z",
  "granted_fields": [
    "predicted_sleep_window",
    "predicted_waking_window",
    "confidence"
  ],
  "predicted_sleep_window": {
    "earliest_at": "2026-03-15T12:20:00Z",
    "latest_at": "2026-03-15T13:20:00Z"
  },
  "predicted_waking_window": {
    "earliest_at": "2026-03-15T20:05:00Z",
    "latest_at": "2026-03-15T21:35:00Z"
  },
  "confidence": "medium",
  "notice": "Estimated windows are uncertain and are not medical advice."
}
